{
  "request_id": "REQ-LINUX-001",
  "status": "no_results",
  "dataset_version": "amazon-reviews-2023:seed=20261014:processed_at=2026-10-14T10:41:15.143181+00:00",
  "applied_filters": {},
  "unverified_conditions": [],
  "items": [],
  "error_code": null,
  "supported_categories": [
    "Appliances",
    "Clothing_Shoes_and_Jewelry",
    "Grocery_and_Gourmet_Food"
  ]
}
